{
  "repo": "crucible",
  "charter": ".crucible/charter.json",
  "approvals": ".crucible/approvals.json",
  "gateRunner": {
    "command": "sh scripts/verify.sh",
    "file": "scripts/verify.sh",
    "checkerPattern": "sh (checks/check-[a-z-]+\\.sh)"
  },
  "highRiskUnits": [
    "hook",
    "charter",
    "mutation",
    "coverage",
    "pre_push",
    "smells",
    "reality",
    "approve",
    "main"
  ],
  "prePush": ".githooks/pre-push",
  "pinnedConfig": [
    ".crucible/adapter.json",
    ".crucible/acceptance.json",
    ".crucible/mutation.json",
    ".crucible/coverage.json",
    ".crucible/flake.json",
    "scripts/verify.sh",
    "scripts/coverage.sh",
    "scripts/mutate-diff.sh"
  ]
}
