{
  "repo": "demo",
  "charter": ".crucible/charter.json",
  "approvals": ".crucible/approvals.json",
  "gateRunner": {
    "command": "sh scripts/verify.sh",
    "file": "scripts/verify.sh",
    "checkerPattern": "sh (checks/check-[a-z-]+\\.sh)"
  },
  "highRiskUnits": [
    "core"
  ],
  "pinnedConfig": [
    ".crucible/adapter.json",
    ".crucible/acceptance.json",
    ".crucible/mutation.json"
  ],
  "prePush": ".githooks/pre-push"
}
